{
  "$schema": "schemas/evaluation-design-contract.schema.json",
  "schemaVersion": 1,
  "artifactType": "EvaluationDesignContract",
  "evaluationDesignContractRevision": "retrieval-v2-evaluation-design-v1",
  "status": "frozen-unmaterialised-unscored",
  "authorityId": "AUTH-RB1-EVALUATION-DESIGN-FREEZE-001",
  "createdDate": "2026-08-12",
  "contractSha256": "0e8d928aee055211773d83eb33f2d54485033c81cfad15dd95b0fdd551f8ed08",
  "baseline": {
    "branch": "main",
    "commit": "45cbcf2624262572abf8180498ac63709a9130e4",
    "treeState": "clean",
    "promptCorpusVersion": "4.10.33",
    "openApiV1": {
      "sha256": "d6a686b94c926914beb28b437f464430a01de6560c2e2d476cf5c36025813e34",
      "gitBlob": "a5fb3602fbab33bda6aa56cc4caaa9fdc37c8160"
    },
    "openApiV2": {
      "sha256": "f4dca8db7fb7bd453e580495bb1bb7760812d954344931063e8549ed8f036733",
      "gitBlob": "5ed6a47631653dd0c137b6ea1e979ae2c14bf8a8"
    }
  },
  "identities": {
    "gateId": "RB-1",
    "retrievalBoundaryId": "retrieval-v2@frozen-query-vector",
    "retrievalPolicyVersion": "retrieval-v2",
    "numericalSemanticsId": "cosine-f32mul-f64acc-boundary-canonical-v1",
    "vectorStoreDescriptor": "sqlite-exact-vector-store/2;schema=1;distance=cosine;algorithm=exact-scan;vector=float32;score=cosine-f32mul-f64acc-boundary-canonical-v1",
    "scorerId": "retrieval-evaluation-scorer-v1",
    "canonicalisationId": "retrieval-result-canonicalisation-v1",
    "questionNormalisationId": "retrieval-question-normalisation-v1",
    "ranking": "Score DESC, global ChunkOrdinal ASC",
    "vectorTopK": 8,
    "minimumScorePolicy": "minimum-score-v1",
    "minimumScore": 0.25,
    "minimumScoreInclusive": true,
    "maximumSelectedEvidence": 6,
    "maximumSelectedEvidenceScalars": 16000,
    "queryVectorCountPerBaselineCase": 1,
    "queryVectorMaterialisationGate": "RB-3",
    "multiQueryStatus": "parked-non-canonical"
  },
  "materialisationCounters": {
    "productDocumentCount": 0,
    "productCaseCount": 0,
    "qrelCount": 0,
    "queryVectorCount": 0,
    "indexGenerationCount": 0,
    "scoredRunCount": 0,
    "observedResultCount": 0
  },
  "companionInventory": [
    { "path": "canonicalisation-manifest.json", "artifactType": "CanonicalisationManifest", "sha256": "e100aab91831ae76a8e641983e8b04a9d8ce403d3a598fd10886a116d7df7ff2" },
    { "path": "contract-fixture-matrix.json", "artifactType": "ContractFixtureMatrixDesign", "sha256": "eb3660a09885fe29c882e890198745c6edd0d01c9b18a0116793d8a71de6b0ce" },
    { "path": "eligibility-fixture-matrix.json", "artifactType": "EligibilityFixtureMatrixDesign", "sha256": "bbb0c92c02fb04e91cf2fdcdaf48dc1489005ebc935cc0ff9479dda854eaaccf" },
    { "path": "question-normalisation-manifest.json", "artifactType": "QuestionNormalisationManifest", "sha256": "6e40a3013a2636a92ce47f7b52d80401f56f2311127d5e25c14180313a8a48d3" },
    { "path": "rubric.json", "artifactType": "RetrievalEvaluationRubric", "sha256": "15dc19c8d374505fa14cc65cc848d4175a6e1f12fe343d241855eeb7ea920d8c" },
    { "path": "sampling-plan.json", "artifactType": "SamplingPlan", "sha256": "013b4a4977b1310266db2d65af22712e121aacce50c156164c0912442c0b2c17" },
    { "path": "schemas/campaign-input-freeze-manifest.schema.json", "artifactType": "JsonSchema", "sha256": "a330cd11ada323d0bbc27e0d5916edea16ae779db257153798c042898f32d25a" },
    { "path": "schemas/campaign-input-manifest.schema.json", "artifactType": "JsonSchema", "sha256": "547f3d72fedd49211281a01853890d971669d258c087a5d0d49c1759c9113ea0" },
    { "path": "schemas/canonicalisation-manifest.schema.json", "artifactType": "JsonSchema", "sha256": "6f7f16fa9ad22278c57f40d86cffad2f272edee5ac7a83aada1e52533fb089d3" },
    { "path": "schemas/case-inventory.schema.json", "artifactType": "JsonSchema", "sha256": "3c0d785b34b2a46f2bfb2390128e013b6feb2958258ee51f078466a288a4e635" },
    { "path": "schemas/contract-fixture-matrix.schema.json", "artifactType": "JsonSchema", "sha256": "f612d8e599237bb7b46a590e797f89e0e3fcd7b008a3db6ecd1cf3c451babbde" },
    { "path": "schemas/dataset-manifest.schema.json", "artifactType": "JsonSchema", "sha256": "9dd9d4ee9a4e71297d725de2f9e9ab90e05ef552ebc4317394a0b03c7b1a45b5" },
    { "path": "schemas/document-manifest.schema.json", "artifactType": "JsonSchema", "sha256": "6895b3ae088acf67a42c0d530bcd2ac5053728ef27c685844cc8afa7c1aa0951" },
    { "path": "schemas/eligibility-fixture-matrix.schema.json", "artifactType": "JsonSchema", "sha256": "316922faeae3036dcf8aaea262c452a6a5237a4f2900c9c26f3509775fd323ef" },
    { "path": "schemas/evaluation-design-contract.schema.json", "artifactType": "JsonSchema", "sha256": "07a3c15feca8b504db7d481e690bb50d22528d4d77ab9fc9e3be386903f45aa6" },
    { "path": "schemas/materialisation-freeze-manifest.schema.json", "artifactType": "JsonSchema", "sha256": "0c70e896e5135493522b316bde8830014e8d5e22a1146fb731c63be4dba7ae6b" },
    { "path": "schemas/metrics.schema.json", "artifactType": "JsonSchema", "sha256": "3d46af61304990bed7416e3d30987e12edee1899fd2101ea7e91d32024a7fb44" },
    { "path": "schemas/ordered-retrieval-result.schema.json", "artifactType": "JsonSchema", "sha256": "43ceaa3d03eb73fd571a3f06399c416966e73d3ac00aadcd6d6dcbe486aa1f24" },
    { "path": "schemas/qrels-record.schema.json", "artifactType": "JsonSchema", "sha256": "aaad054dd98154552a3eed9dc38e74e3fffd4b75c9ce7e50b34b29d3cc5c0683" },
    { "path": "schemas/query-vector-manifest.schema.json", "artifactType": "JsonSchema", "sha256": "e95bffc011f4fd4abcb4490fe5a9039cce52b474db8dce1092b7784ae6225037" },
    { "path": "schemas/question-normalisation-manifest.schema.json", "artifactType": "JsonSchema", "sha256": "9d5f0a4c910bb6543a253d7d7adeb4f10fd42b4a53950f47266e082a214e3732" },
    { "path": "schemas/retrieval-policy-manifest.schema.json", "artifactType": "JsonSchema", "sha256": "21db9c862eefffec11e86e78d9f21d81549ed7ff972e55f65e108930e83888d4" },
    { "path": "schemas/rubric.schema.json", "artifactType": "JsonSchema", "sha256": "4ee3422695c132d83a7f9e125266552496e0b8bd60ac42c7c43843a1cf8fa0e0" },
    { "path": "schemas/run-manifest.schema.json", "artifactType": "JsonSchema", "sha256": "c13f831dd5625745a44466206e055e73758cff86db15a8332ff094df4de5ca63" },
    { "path": "schemas/sampling-plan.schema.json", "artifactType": "JsonSchema", "sha256": "ea014be8a65fac93bcdc4d7d8bfe16137e51740d39125103ab22f5d1c1d96103" },
    { "path": "schemas/scorer-manifest.schema.json", "artifactType": "JsonSchema", "sha256": "e2ea276e05cf63eb9e71fe6def8fc806fe3431ef728b256a035860f4a72d8452" },
    { "path": "scorer-manifest.json", "artifactType": "ScorerManifest", "sha256": "11f9db88863bb9c26a3e9c6ffcd825701d59419cbcba9406e789c7bef099db0b" }
  ],
  "formulaCatalogue": [
    { "id": "SelectedEvidenceRelevantLocationRecall@5_i", "definition": "For positive case i, eligible grade-2 groups from non-empty L_i represented in the first five final selected-evidence items T_i^5 divided by |L_i|." },
    { "id": "SelectedEvidenceMRR@5_i", "definition": "1/rank_i when the first eligible grade-2 item is at rank 1..5; otherwise 0." },
    { "id": "RawVectorRelevantLocationRecall@5_i", "definition": "Groups from L_i present in the first five raw hits divided by |L_i|." },
    { "id": "RequiredFactGroupCoverage@5_i", "definition": "Required facts with at least one selected grade-2 association divided by all required facts for the case." },
    { "id": "SelectedEvidencePrecision@5_i", "definition": "Ranks 1..5 with an eligible grade-2 association divided by 5; absent ranks contribute zero." },
    { "id": "DCG@5", "definition": "sum for r=1..5 of (2^grade_r - 1) / log2(r + 1)." },
    { "id": "nDCG@5", "definition": "DCG@5 / IDCG@5; zero IDCG produces nDCG=0 only in the separate negative denominator." },
    { "id": "canonical-overall-macro", "definition": "Simple arithmetic mean over positive cases." },
    { "id": "stratum-macro", "definition": "Simple arithmetic mean over positive cases in that stratum." },
    { "id": "semantic-diagnostic-macro", "definition": "Mean across variants within each semanticCaseGroupId, then simple mean across groups." },
    { "id": "DigestMatchRate", "definition": "Planned comparisons with an ordered digest identical to the reference divided by all planned comparisons." },
    { "id": "FiniteScoreRate", "definition": "Finite scores in raw hits for quality cases divided by all scores in those raw hits." },
    { "id": "ExecutionCompleteness", "definition": "Quality cases ending in Succeeded or NoSelectedEvidenceUnderPolicy divided by all frozen quality cases." },
    { "id": "JudgementCoverage@5", "definition": "Judged items in final top-five sequences divided by all items in those sequences." },
    { "id": "ContractMatrixCoverage", "definition": "Materialised mandatory contract cells divided by 38." },
    { "id": "ContractFixturePassRate", "definition": "Fixtures with exact outcome and assertions divided by 38." },
    { "id": "LeakageMatrixCoverage", "definition": "Materialised boundary cells divided by 10." },
    { "id": "LeakageCaseRate", "definition": "Adversarial cases returning at least one Ineligible item divided by all adversarial cases." },
    { "id": "NegativeEmptySelectionRate", "definition": "Negative cases returning NoSelectedEvidenceUnderPolicy divided by all negative cases." },
    { "id": "PositiveEmptySelectionRate", "definition": "Positive cases returning NoSelectedEvidenceUnderPolicy divided by all positive cases." },
    { "id": "threshold-distance", "definition": "score - 0.25." },
    { "id": "nearest-rank-percentile", "definition": "For p50, p95, and p99, the ordered value at position ceiling(p*n), using a one-based index." },
    { "id": "zero-denominator", "definition": "A zero denominator for a hard rate or mandatory stratum is NOT_EVALUABLE and fails the gate." },